NAME_LOC,NAME_EN,TYPE,TYPECODE,SUBTYPE,LEVEL,LEVELCODE,POSTCODE,ADDRESS_LOC,ADDRESS_EN,CITY_LOC,CITY_EN,FOCAL_PERSON_LOC,FOCAL_PERSON_EN,TELEPHONE,EMAIL,WEBSITE,SOURCE_EN,SOURCE_LOC,LATITUDE,LONGITUDE,ISO3,COUNTRY,NATIONAL_SOCIETY,GOLOCALUNITID,NSLOCALUNITID,DATEOFUPDATE,VALIDATED,PUBLICVIEW
Cruz Vermelha - Órgão Central HQ,,Administrative,1,Office,Head Office,0,20230-130,"Praça Cruz Vermelha N° 10-12, Centro, Rio de Janeiro - RJ",,Rio de Janeiro - RJ,,Thiago Quintaneiro,,55 (21) 2507-3577 / 2507-3392,secretario.cooperacao@cvb.org.br,http://www.cruzvermelha.org.br/,,Brazilian Red Cross,-22.91111111,-43.1875,BRA,Brazil,Brazilian Red Cross,,,7-Feb-24,Yes,Yes
Cruz Vermelha - Órgão Central HQ - Brasília,,Administrative,1,Office,Head Office,0,70300-910,"Setor Comercial Sul (SCS), quadra 6, bloco A, nº 157, salas 502 e 503 - Edifício Bandeirantes, Asa Sul, Brasília-DF  ",,Brasília - DF,,Lourenço Braga,,55 (61) 99909-0761,secretario.geral@cvb.org.br,http://www.cruzvermelha.org.br/,,Brazilian Red Cross,-15.79638889,-47.88972222,BRA,Brazil,Brazilian Red Cross,,,7-Feb-24,Yes,Yes
Filial Alagoas,,Administrative,1,Office,Provincial,1,57035-530,"Av. Com. Gustavo de Paiva, 2889 - Mangabeiras, Maceió - AL",,Alagoas - AL,,Agarina Mendonça,,55 (82) 3325-2430,diretoria@cvbal.org.br,https://www.cruzvermelha.org.br/pb/filiais/alagoas/,,Brazilian Red Cross,-9.64777778,-35.71611111,BRA,Brazil,Brazilian Red Cross,,,7-Feb-24,Yes,Yes
Filial Amapá,,Administrative,1,Office,Provincial,1,68902-030,"R. Jovino Dinoa, 3868, Centro, Macapá - AP",,Amapá - AP,,Ana Célia Trindade,,55 (96) 99111-6656,cvbap@cvb.org.br,https://www.cruzvermelha.org.br/pb/tag/amapa/,,Brazilian Red Cross,0.01722222,-51.06138889,BRA,Brazil,Brazilian Red Cross,,,7-Feb-24,Yes,Yes
Filial Amazonas,,Administrative,1,Office,Provincial,1,69400-220,"Avenida Getulio Vargas, 381 - Centro, Manaus - AM",,Manaus - AM,,Mário Aníbal Gomes,,55 (92) 988551-3484,secretaria@cvbam.org,http://www.cruzvermelha.org.br/products/amazonas/,,Brazilian Red Cross,-3.13194444,-60.02083333,BRA,Brazil,Brazilian Red Cross,,,7-Feb-24,Yes,Yes
Filial Bahia,,Administrative,1,Office,Provincial,1,41100-800,"Av. Tancredo Neve, 1632, Caminho das Arvores, Salvador - BA",,Salvador - BA,,Eduardo Umbelino,,55 (71) 98105-0519,secretaria@cvbba.org.br,http://www.cruzvermelha.org.br/products/bahia/,,Brazilian Red Cross,-12.97916667,-38.45194444,BRA,Brazil,Brazilian Red Cross,,,7-Feb-24,Yes,Yes
Filial Ceará,,Administrative,1,Office,Provincial,1,60115-280,"Rua José Lourenço,3.280 Aldeota, Fortaleza - CE",,Fortaleza - CE,,Allan Gerson,,55 (85) 3182-3441,presidente@cvbce.com.br,http://www.cruzvermelha.org.br/products/ceara/,,Brazilian Red Cross,-3.73666667,-38.50833333,BRA,Brazil,Brazilian Red Cross,,,7-Feb-24,Yes,Yes
Filial Distrito Federal,,Administrative,1,Office,Provincial,1,70750-557,"SCLRN 715, Bloco C , Loja 25, Asa Norte, Brasília - DF",,Brasília - DF,,Ellen Marta,,55 (61) 3361-6904,secretaria@cvbb.org.br,http://www.cruzvermelha.org.br/products/distrito-federal/,,Brazilian Red Cross,-15.74361111,-47.89805556,BRA,Brazil,Brazilian Red Cross,,,7-Feb-24,Yes,Yes
Filial Maranhão,,Administrative,1,Office,Provincial,1,65036-170,"Av. Getúlio Vargas, 47 - Fabril, São Luis - MA",,São Luiz - MA,,Carlos Alberto,,55 (98) 3249-9712,presidencia.ma@cvb.org.br,http://www.cruzvermelha.org.br/products/maranhao/,,Brazilian Red Cross,-2.535,-44.27777778,BRA,Brazil,Brazilian Red Cross,,,7-Feb-24,Yes,Yes
Filial Mato Grosso,,Administrative,1,Office,Provincial,1,78055-000,"Av. Historiador Rubens de Mendonça, 5925, CPA I, Cuiabá - MT",,Cuiabá - MT,,Marcos Divino,,55 (65) 3641-2629,presidencia.mt@cvb.org.br,http://www.cruzvermelha.org.br/products/mato-grosso/,,Brazilian Red Cross,-15.55166667,-56.05527778,BRA,Brazil,Brazilian Red Cross,,,7-Feb-24,Yes,Yes
Filial Mato Grosso do Sul,,Administrative,1,Office,Provincial,1,79071-310,"Rua Barão de Melgaço, 58, Centro, Campo Grande - MS",,Campo Grande - MS,,Aline Jussara,,55 (67) 99894-6999,presidencia@cruzvermelhams.org.br,http://www.cruzvermelha.org.br/products/mato-grosso-do-sul/,,Brazilian Red Cross,-20.4675,-54.61277778,BRA,Brazil,Brazilian Red Cross,,,7-Feb-24,Yes,Yes
Filial Minas Gerais,,Administrative,1,Office,Provincial,1,30130-100,"Alameda Ezequiel Dias, 427- Centro, Belo Horizonte - MG",,Belo Horizonte - MG,,Ricardo Márcio,,55 (31) 3226-4233,presidencia.mg@cvb.org.br,http://www.cruzvermelha.org.br/products/minas-gerais/,,Brazilian Red Cross,-19.92611111,-43.93194444,BRA,Brazil,Brazilian Red Cross,,,7-Feb-24,Yes,Yes
Filial Pará,,Administrative,1,Office,Provincial,1,66095-494,"Travessa Baríão do Triunfo. Passagem Nossa Senhora das Graças, 58, Marco, Belém - PA",,Belém - PA,,Isaías Oscar,,55 (91) 3226-2556,presidente.cvbpa@cvb.org.br,http://www.cruzvermelha.org.br/products/para/,,Brazilian Red Cross,-1.45527778,-48.49333333,BRA,Brazil,Brazilian Red Cross,,,7-Feb-24,Yes,Yes
Filial Paraná,,Administrative,1,Office,Provincial,1,85812-010,"Rua Vicente Machado, 1.310, Centro, Curitiba - PR",,Curitiba - PR,,Leonardo Hanrique,,55 (41) 3016-6622,presidencia.pr@cvb.org.br,http://www.cruzvermelha.org.br/products/parana/,,Brazilian Red Cross,-25.43694444,-49.28944444,BRA,Brazil,Brazilian Red Cross,,,7-Feb-24,Yes,Yes
Filial Rio de Janeiro,,Administrative,1,Office,Provincial,1,20230-130,"Praça Cruz Vermelha N° 10-12, Centro, Rio de Janeiro - RJ",,Rio de Janeiro - RJ,,Flávia Aires,,55 (21) 96746-4448,compliance@cruzvermelharj.org.br,https://www.cruzvermelha.org.br/pb/filiais/rio-de-janeiro/,,Brazilian Red Cross,-22.91111111,-43.1875,BRA,Brazil,Brazilian Red Cross,,,7-Feb-24,Yes,Yes
Filial Rio Grande do Norte,,Administrative,1,Office,Provincial,1,59025-001,"Rua Dr. Manoel Augusto Bezerra de Araújo, 77, Ponta Negra, Natal - RN",,Natal - RN,,Kelyson de Lima ,,55 (84) 3201-6400,presidencia@cvbrn.org,http://www.cruzvermelha.org.br/products/rio-grande-do-norte/,,Brazilian Red Cross,-5.88194444,-35.1775,BRA,Brazil,Brazilian Red Cross,,,7-Feb-24,Yes,Yes
Filial Rio Grande do Sul,,Administrative,1,Office,Provincial,1,90035-077,"Av. Independência, 993, Independência, Porto Alegre - RS",,Porto Alegre - RS,,Pedro Moura ,,55 (21) 97492-9833,pedro.moura@cruzvermelharj.org.br,http://www.cruzvermelha.org.br/products/rio-grande-do-sul/,,Brazilian Red Cross,-30.02944444,-51.21111111,BRA,Brazil,Brazilian Red Cross,,,7-Feb-24,Yes,Yes
Filial Santa Catarina,,Administrative,1,Office,Provincial,1,88070-100,"Rua Santos Saraiva, 821, Estreito, Florianópolis - SC",,Florianópolis - SC,,Luiz Antônio ,,55 (48) 3244-6681,presidencia.sc@cvb.org.br,http://www.cruzvermelha.org.br/products/santa-catarina/,,Brazilian Red Cross,-27.59527778,-48.5825,BRA,Brazil,Brazilian Red Cross,,,7-Feb-24,Yes,Yes
Filial Sao Paulo,,Administrative,1,Office,Provincial,1,04074-031,"Av. Moreira Guimaríes, 699, Indianópolis, São Paulo - SP",,São Paulo - SP,,Jorge Wolney,,55 (11) 5056-8666,presidencia.sp@cvb.org.br,http://www.cruzvermelha.org.br/products/sao-paulo/,,Brazilian Red Cross,-23.6125,-46.65666667,BRA,Brazil,Brazilian Red Cross,,,7-Feb-24,Yes,Yes
Filial Sergipe,,Administrative,1,Office,Provincial,1,49015-130,"Praça Tobias Barreto, 132 Bairro São José, Aracaju - SE",,Aracajú - SE,,Lourenço Braga,,55 (61) 99909-0761,secretario.geral@cvb.org.br,http://www.cruzvermelha.org.br/products/sergipe/,,Brazilian Red Cross,-10.92694444,-37.05027778,BRA,Brazil,Brazilian Red Cross,,,7-Feb-24,Yes,Yes
Coordenação de Roraima ,,Administrative,1,Office,Ward,3,69304-350,"Av. Mário Homem de Melo, 2310 - Mecejana, Boa Vista - RR",,Boa Vista - RR,,Leila Marcia,,55 (95) 99122-1403,cvbrr@cvb.org.br,http://www.cruzvermelha.org.br/,,Brazilian Red Cross,2.82277778,-60.69388889,BRA,Brazil,Brazilian Red Cross,,,7-Feb-24,Yes,Yes
Hospital da Cruz Vermelha Brasileira Paraná,,Health Care,2,Hospital,,,80730-420,"Rua: Capitão Souza Franco, 50 - Batel, Curitiba - PR",,Curitiba - PR,,Leonardo Hanrique,,55 (41) 3016-6622,presidencia.pr@cvb.org.br,http://www.cruzvermelha.org.br/products/parana/,,Brazilian Red Cross,-25.43694444,-49.28944444,BRA,Brazil,Brazilian Red Cross,,,7-Feb-24,Yes,Yes
বরগুনা রেড ক্রিসেন্ট ইউনিট,Barguna Red Crescent Unit,Administrative,1,Branch office,District,2,,"সিরাজউদ্দিন রোড, টাউন হল, বরগুনা ৮৭০০","Sirajuddin Road, Town Hall, Barguna 8700",,Barguna,মাহবুবুর রহমান মিলন,Mahbubur Rahman milon,17183223040,barguna@bdrcs.org,http://www.bdrcs.org/,Bangladesh Red Crescent Society,,22.1614375,90.1227277,BGD,Bangladesh,Bangladesh Red Crescent Society,,1,7-Feb-24,Yes,Yes
বরিশাল রেড ক্রিসেন্ট ইউনিট,Barisal Red Crescent Unit,Administrative,1,Branch office,District,2,,"ব্যান্ড রোড, ডিসি লঞ্চ ঘাট, বরিশাল","Band Road, DC Launch Ghat, Barishal",,Barisal,এএসএম গোলাম কবির,ASM Golam Kabir,1712150959,barishal@bdrcs.org,http://www.bdrcs.org/,Bangladesh Red Crescent Society,,22.698051,90.3741722,BGD,Bangladesh,Bangladesh Red Crescent Society,,2,7-Feb-24,Yes,Yes
ভোলা রেড ক্রিসেন্ট ইউনিট,Bhola Red Crescent Unit,Administrative,1,Branch office,District,2,,"রেড ক্রিসেন্ট ভবন, নতুন বাজার, ভোলা সদর, ভোলা","Red Cerscent Bhaban, Natun Bazar,Bhola Sader,Bhola",,Bhola,মোঃ আবদুল বারী,Md. Abdul Bari,1716355165,bhola@bdrcs.org,http://www.bdrcs.org/,Bangladesh Red Crescent Society,,22.6854033,90.6463914,BGD,Bangladesh,Bangladesh Red Crescent Society,,3,7-Feb-24,Yes,Yes
ঝালকাঠি রেড ক্রিসেন্ট ইউনিট,Jhalakathi Red Crescent Unit,Administrative,1,Branch office,District,2,,"পুরাতন কলেজ রোড, ঝালাকাঠি","Old Collage Road, Jhalakathi",,Jhalakathi,ইকবাল মাসুদ,Iqbal Masud,1711037672,jhalakathi@bdrcs.org,http://www.bdrcs.org/,Bangladesh Red Crescent Society,,22.6406182,90.2035921,BGD,Bangladesh,Bangladesh Red Crescent Society,,4,7-Feb-24,Yes,Yes
পটুয়াখালী রেড ক্রিসেন্ট ইউনিট,Patuakhali Red Crescent Unit,Administrative,1,Branch office,District,2,,"পুরাতন ফৌজদার ভবন, লঞ্চ ঘাট, পটুয়াখালী","Puraton Foujdar Bhaban, Launch Ghat,Patukhali",,Patuakhali,এমডি ফারুক হোসিন,"Md, Faruk Hossin",1712981322,Patukhali@bdrcs.org,http://www.bdrcs.org/,Bangladesh Red Crescent Society,,22.3605663,90.3505268,BGD,Bangladesh,Bangladesh Red Crescent Society,,5,7-Feb-24,Yes,Yes
পিরোজপুর রেড ক্রিসেন্ট ইউনিট,Pirojpur Red Crescent Unit,Administrative,1,Branch office,District,2,,"রেড ক্রিসেন্ট ভবন (স্টেডিয়ামের নিকটে), হুলারহাট রোড, পিরোজপুর -৮৫০০","Red Crescent Bhaban (Near to Stadium),Hularthat Road,Pirojpur-8500",,Pirojpur,মহাবুবুর রহমান মিলন,Mahabubur Rahman Milon,1720548462,pirojpurbdrcs.org,http://www.bdrcs.org/,Bangladesh Red Crescent Society,,22.5792733,89.9826263,BGD,Bangladesh,Bangladesh Red Crescent Society,,6,7-Feb-24,Yes,Yes
বান্দরবন রেড ক্রিসেন্ট ইউনিট,Bandarban Red Crescent Unit,Administrative,1,Branch office,District,2,,"রেড ক্রিসেন্ট ভবন, বান্দরবন",Do,,Bandarban,মোহাম্মদ মোশারেফ হোসেন,Mohammed Mosharef Hossain,,bandarban@bdrcs.org,http://www.bdrcs.org/,Bangladesh Red Crescent Society,,22.1814602,92.1933848,BGD,Bangladesh,Bangladesh Red Crescent Society,,7,7-Feb-24,Yes,Yes
ব্রাক্ষণবাড়িয়া রেড ক্রিসেন্ট ইউনিট,Brahmanbaria Red Crescent Unit,Administrative,1,Branch office,District,2,,"রেড ক্রিসেন্ট ভবন, সদর হাসপাতাল রোড, ব্রাহ্মণবারিয়া- ৩৪০০","Red Cerscent Bhaban, Sadar Hospital road, Brahmanbaria- 3400",,Brahmanbaria,মিঃ পঙ্কজ কুমার সরকার,Mr. Pankaj Kumar Sarkar,880-2-334427120,brahmanbaria@bdrcs.org,http://www.bdrcs.org/,Bangladesh Red Crescent Society,,23.9758278,91.1107374,BGD,Bangladesh,Bangladesh Red Crescent Society,,8,7-Feb-24,Yes,Yes
চাঁদপুর রেড ক্রিসেন্ট ইউনিট,Chandpur Red Crescent Unit,Administrative,1,Branch office,District,2,,"রেড ক্রিসেন্ট ভবন, কাজী নাজরুল সরক, চাঁদপুর সদর, চাঁদপুর","Red Crescent Bhaban, Kazi Nazrul Sarak, Chandpur Sadar, Chandpur",,Chandpur,মোঃ বাজলুর করিম চৌধুরী,Md. Bazlur Karim Chowdhury ,01712295735,chandpur@bdrcs.org,http://www.bdrcs.org/,Bangladesh Red Crescent Society,,23.2225775,90.653899,BGD,Bangladesh,Bangladesh Red Crescent Society,,9,7-Feb-24,Yes,Yes
চট্টগ্রাম সিটি রেড ক্রিসেন্ট ইউনিট,Chattogram City Red Crescent Unit,Administrative,1,Branch office,District,2,,"সানমার স্প্রিং গার্ডেন, 64 জামাল খান রোড","Sanmar Spring Garden, 64 Jamal Khan Road",,Chattogram City,মোঃ আবদুল রহিম আকন,Md. Abdul Rahim Akon,01819317456,chattogramcity@bdrcs.org,http://www.bdrcs.org/,Bangladesh Red Crescent Society,,22.345351,91.8387438,BGD,Bangladesh,Bangladesh Red Crescent Society,,10,7-Feb-24,Yes,Yes
 চট্টগ্রাম জেলা রেড ক্রিসেন্ট ইউনিট,Chattogram District Red Crescent Unit,Administrative,1,Branch office,District,2,,"চট্টগ্রাম জেলা রেড ক্রিসেন্ট ইউনিট, রেড ক্রিসেন্ট বিল্ডিং, ৩৯৫ আন্দরকিল্লা, চট্টগ্রাম","Chattogram district red crescent unit, red crescent building,395 Anderkilla, Chattogram.",,Chattogram District,মোঃ আবদুল মান্নান,Md. Abdul Mannan,1819173034,chattogramdist@bdrcs.org,http://www.bdrcs.org/,Bangladesh Red Crescent Society,,22.3453776,91.8387708,BGD,Bangladesh,Bangladesh Red Crescent Society,,11,7-Feb-24,Yes,Yes
কক্সবাজার রেড ক্রিসেন্ট ইউনিট,Cox's Bazar Red Crescent Unit,Administrative,1,Branch office,District,2,,"মোটেল রোড, কক্সবাজার সদর","Motel Road, Cox's Bazar,sadar",,Cox's Bazar,মো। সাইফুল ইসলাম,Md. Saiful Islam,1810112212,ocxsbazar@bdrcs.org,http://www.bdrcs.org/,Bangladesh Red Crescent Society,,21.4396429,91.969217,BGD,Bangladesh,Bangladesh Red Crescent Society,,12,7-Feb-24,Yes,Yes
কুমিল্লা রেড ক্রিসেন্ট ইউনিট,Cumilla Red Crescent Unit,Administrative,1,Branch office,District,2,,"নবাব ফয়জুনেসা রোড, কুমিল্লা ৩৫০০","Nobaba Fayjunnesa Rd, Comilla 3500",,Cumilla,কাজী জানে আলম,Kazi Jane Alam,01714373530,cumilla@bdrcs.org,http://www.bdrcs.org/,Bangladesh Red Crescent Society,,23.4675455,91.1778184,BGD,Bangladesh,Bangladesh Red Crescent Society,,13,7-Feb-24,Yes,Yes
ফেনী রেড ক্রিসেন্ট ইউনিট,Feni Red Crescent Unit,Administrative,1,Branch office,District,2,,"রাজার ডিঘির পূর্বের পারা, ফেনি ৩৯০০০","Rajar Dighirpurberpar, Feni 3900",,Feni,আলাউদ্দিন প্যাটোয়ারি,Alauddin Patoary,1711385009,feni@bdrcs.org,http://www.bdrcs.org/,Bangladesh Red Crescent Society,,23.0107722,91.4008214,BGD,Bangladesh,Bangladesh Red Crescent Society,,14,7-Feb-24,Yes,Yes
 খাগড়াছড়ি রেড ক্রিসেন্ট ইউনিট,Khagrachari Red Crescent Unit,Administrative,1,Branch office,District,2,,"উচ্চ বিদ্যালয়ের মাঠের কাছে, আদলাত সড়ক, খারাচরি সদর","Near High School Field, Adalat Sarak,Kharachari Sadar",,Khagrachari,আবদুল গানি মজুমদার,Abdul Gani Majumder,+88 02 3333 43059,khagrachari@bdrcs.org,http://www.bdrcs.org/,Bangladesh Red Crescent Society,,23.1110895,91.9888253,BGD,Bangladesh,Bangladesh Red Crescent Society,,15,7-Feb-24,Yes,Yes
লক্ষীপুর রেড ক্রিসেন্ট ইউনিট,Lakshmipur Red Crescent Unit,Administrative,1,Branch office,District,2,,"রেহান উদ্দিন ভুঁইয়া সড়ক, পুরাতন শহীদ মিনার রোড, লক্ষীপুর -৩৭০০","Rehan Uddin Bhuya Sarak, Puraton Shahid Minar Road, Lakshimpur-3700",,Lakshmipur,নাসরিন আকটার,Nasrin Akter,01815215945,lakshimpur@bdrcs.org,http://www.bdrcs.org/,Bangladesh Red Crescent Society,,22.9411711,90.8376381,BGD,Bangladesh,Bangladesh Red Crescent Society,,16,7-Feb-24,Yes,Yes
নোয়াখালী রেড ক্রিসেন্ট ইউনিট,Noakhali Red Crescent Unit,Administrative,1,Branch office,District,2,,"নোয়াখালী রেড ক্রিসেন্ট ভবান, জেদাইগদী কোর্ট, নোয়াখালী","Noakhali Red Crescent Bhaban,Jedaigdi Court, Noakhali",,Noakhali,আবদুল করিম,Abdul Karim,1810849420,noakhali@bdrcs.org,http://www.bdrcs.org/,Bangladesh Red Crescent Society,,22.8665443,91.1005869,BGD,Bangladesh,Bangladesh Red Crescent Society,,17,7-Feb-24,Yes,Yes
রাঙ্গামাটি রেড ক্রিসেন্ট ইউনিট,Rangamati Red Crescent Unit,Administrative,1,Branch office,District,2,,"কে কে রায় সড়ক, রাজবাড়ি রাঙ্গামাটি","K K Roy Sarak, Rajbari Rangamati",,Rangamati,মোঃ শামসুল আলম,Md. Shamsul Alam,2333304735,rangamati@bdrcs.org,http://www.bdrcs.org/,Bangladesh Red Crescent Society,,22.6612555,92.1688454,BGD,Bangladesh,Bangladesh Red Crescent Society,,18,7-Feb-24,Yes,Yes
ঢাকা সিটি রেড ক্রিসেন্ট ইউনিট,Dhaka City Red Crescent Unit ,Administrative,1,Branch office,District,2,,"ঢাকা সিটি রেড ক্রিসেন্ট ইউনিট, ঢাকা দক্ষিণ সিটি কর্পোরেশন, নগর ভবন, ৫ম তলা, ঢাকা ১০০০","Dhaka City Red Crescent Unit, Dhaka South City Corporation, Ngar Bhaban, 5th Floor, Dhaka 1000",,Dhaka City,ফারজানা আকটার,Farzana Akter,0257164243,dhakacity@bdrcs.org,http://www.bdrcs.org/,Bangladesh Red Crescent Society,,23.7241516,90.408147,BGD,Bangladesh,Bangladesh Red Crescent Society,,19,7-Feb-24,Yes,Yes
ঢাকা জেলা রেড ক্রিসেন্ট ইউনিট,Dhaka District Red Crescent Unit,Administrative,1,Branch office,District,2,,"৩৩ নং পাঁচ ভাই ঘাট লেইন, রাকনপুর, সূত্রাপুর, ঢাকা -১১০০","33 no pach Bhai Ghat lane, Rakonpur, Sutrapur, Dhaka-1100",,Dhaka District,মোঃ নুরুল ইসলাম,Md. Nurul Islam,1797879717,dhakadistrict@bdrcs.org,http://www.bdrcs.org/,Bangladesh Red Crescent Society,,23.7099931,90.4168835,BGD,Bangladesh,Bangladesh Red Crescent Society,,20,7-Feb-24,Yes,Yes
ফরিদপুর রেড ক্রিসেন্ট ইউনিট,Faridpur Red Crescent Unit,Administrative,1,Branch office,District,2,,"রেড ক্রিসেন্ট প্লাজা, আলিপুর, ফরিদপুর","Red Crescent Plaza , Alipur, Faridpur",,Faridpur,পাভেল রহমান,Pavel Rahman,0,faridpur@bdrcs.org,http://www.bdrcs.org/,Bangladesh Red Crescent Society,,23.6030191,89.8329478,BGD,Bangladesh,Bangladesh Red Crescent Society,,21,7-Feb-24,Yes,Yes
গাজীপুর রেড ক্রিসেন্ট ইউনিট,Gazipur Red Crescent Unit,Administrative,1,Branch office,District,2,,"রাজবাড়ি, জয়দেবপুর, গাজীপুর","Rjbari, Joydevpur,Gazipur",,Gazipur,মোঃ কামাল উদ্দিন,Md. Kamal Uddin,01711649877,gazipur@bdrcs.org,http://www.bdrcs.org/,Bangladesh Red Crescent Society,,24.0004232,90.4252626,BGD,Bangladesh,Bangladesh Red Crescent Society,,22,7-Feb-24,Yes,Yes
গোপালগঞ্জ রেড ক্রিসেন্ট ইউনিট,Gopalganj Red Crescent Unit,Administrative,1,Branch office,District,2,,গোপালগঞ্জ,,,Gopalganj,বিপ্লাব কুমার বিশ্বাস,Biplab Kumar Biswas,1711133018,gopalganj@gmail.org,http://www.bdrcs.org/,Bangladesh Red Crescent Society,,23.0043955,89.826664,BGD,Bangladesh,Bangladesh Red Crescent Society,,23,7-Feb-24,Yes,Yes
কিশোরগঞ্জ রেড ক্রিসেন্ট ইউনিট,Kishoreganj Red Crescent Unit,Administrative,1,Branch office,District,2,,"কিশোরগঞ্জ ইউনিট, বত্রিশ রেড ক্রিসেন্ট মোড়, কিশোরগঞ্জ ২৩০০","Bangladesh Red Crescent Society, Kishoreganj Unit, Bottiris Red Crescentmor, Kishoreganj-2300.",,Kishoreganj,মোঃ আবদুল মোটালিব,Md. Abdul Motalib ,01911-010212,       kishoreganj@bdrcs.org,http://www.bdrcs.org/,Bangladesh Red Crescent Society,,24.4308244,90.781178,BGD,Bangladesh,Bangladesh Red Crescent Society,,24,7-Feb-24,Yes,Yes
মাদারিপুর রেড ক্রিসেন্ট ইউনিট,Madaripur Red Crescent Unit,Administrative,1,Branch office,District,2,,"মাদারিপুর পুরাতন কোর্ট রোড, নতুন শহর, সদর, মাদারিপুর","Madaripur Puraton Court Road, Noton Sohor, Sadar, Madaripur",,Madaripur,পঙ্কজ কুমার সরকার,Pankaj Kumar Sarkar,1718126884,madaripur@bdrcs.org,http://www.bdrcs.org/,Bangladesh Red Crescent Society,,23.1669405,90.2097861,BGD,Bangladesh,Bangladesh Red Crescent Society,,25,7-Feb-24,Yes,Yes
মানিকগঞ্জ রেড ক্রিসেন্ট ইউনিট,Manikganj Red Crescent Unit,Administrative,1,Branch office,District,2,,"শহীদ রফিক সড়ক, সদার, মানিকগঞ্জ","Shahid Rafik Sarak, Sadar, Manikganj",,Manikganj,মো জ্যাটিকুর রহমান,Md. Ztikur Rahman,1721446220,manikganj@bdrcs.org,http://www.bdrcs.org/,Bangladesh Red Crescent Society,,23.85939328,90.00716141,BGD,Bangladesh,Bangladesh Red Crescent Society,,26,7-Feb-24,Yes,Yes
মুন্সিগঞ্জ রেড ক্রিসেন্ট ইউনিট,Munshiganj Red Cresecent Unit,Administrative,1,Branch office,District,2,,"আলহবাজ মো মহিউদ্দীন রেড ক্রিসেন্ট ভবন, হাতলক্ষীগঞ্জ, পুরাতন বাস স্টান্ড, মুন্সীগঞ্জ","Alhaj Md. Mohiuddin Red Crescent Bhaban, Hatlakshiganj, Puraton Bus Stand, Munshiganj",,Munshiganj,এমডি জিয়াউল হক,Md.Ziaul Haq,,munshiganj@bdrcs.org,http://www.bdrcs.org/,Bangladesh Red Crescent Society,,23.5586865,90.5326136,BGD,Bangladesh,Bangladesh Red Crescent Society,,27,7-Feb-24,Yes,Yes
নারায়ণগঞ্জ রেড ক্রিসেন্ট ইউনিট,Narayanganj Red Crescent Unit,Administrative,1,Branch office,District,2,,"১৩০, ভাষা সৈনিক একেএম সামসুজ্জামান সড়ক, উত্তর চাষাড়া, নারায়ানগঞ্জ ১৪০০","130, Bhasa Soinik AKM Shamsuzzoha Sarak, North Chashara, Narayanganj-1400",,Narayanganj,"কাওসার আহমেদ, জাদ","Kawser Ahmed, JAD",01711369915,narayanganj@bdrcs.org,http://www.bdrcs.org/,Bangladesh Red Crescent Society,,23.6260541,90.4995318,BGD,Bangladesh,Bangladesh Red Crescent Society,,28,7-Feb-24,Yes,Yes
নরসিংদি রেড ক্রিসেন্ট ইউনিট,Narsingdi Red Crescent Unit,Administrative,1,Branch office,District,2,,"৩০৮ রেড ক্রিসেন্ট ভবন, পশ্চিম ব্রামন্ডি (উত্তর টাউন হল), নরসিংদী ১৬০২","308, Red Crescent Bhaban, West Brahmondi (Old Town Hall), Narsingdi-1602",,Narsingdi,মো কাওসার আহমেদ,Md. Kawser Ahmed,01711-344269,narsingdi@bdrcs.org,http://www.bdrcs.org/,Bangladesh Red Crescent Society,,23.919267,90.717649,BGD,Bangladesh,Bangladesh Red Crescent Society,,29,7-Feb-24,Yes,Yes
রাজবাড়ী রেড ক্রিসেন্ট ইউনিট,Rajbari Red Crescent Unit,Administrative,1,Branch office,District,2,,"রেড ক্রিসেন্ট প্লাজা, ১ নং বেরাডাঙ্গা, রাজবাড়ী সদর, রাজবাড়ী- ৭৭০০","Red Crescent Plaza , 1 no Beradanga, Rajbari Sadar, Rajbari-7700",,Rajbari,মো নাজির সিকদার,Md. Nazir Sikder,1715696306,rajbari@bdrcs.org,http://www.bdrcs.org/,Bangladesh Red Crescent Society,,23.761277,89.6487919,BGD,Bangladesh,Bangladesh Red Crescent Society,,30,7-Feb-24,Yes,Yes
